{
  "id": "lesson-11-05",
  "title": "Lesson 11.5: Configuration - Making Your App Flexible",
  "description": "Configure Spring Boot applications with application.properties/yml, inject values with @Value, and use profiles to manage environment-specific settings.",
  "moduleId": "module-11",
  "order": 5,
  "estimatedMinutes": 45,
  "difficulty": "intermediate"
}
