{
  "id": "lesson-09-18",
  "title": "Mini-Project: Chat Backend",
  "description": "Build a complete real-time chat backend combining authentication, database storage, and streaming for message delivery.",
  "moduleId": "module-09",
  "order": 18,
  "estimatedMinutes": 60,
  "difficulty": "intermediate"
}
