{
  "id": "lesson-10-08",
  "title": "Mini-Project: Fitness Tracker App",
  "description": "Build a fitness tracker app combining device sensors, background tasks, and local data persistence for step counting and activity tracking.",
  "moduleId": "module-10",
  "order": 8,
  "estimatedMinutes": 60,
  "difficulty": "intermediate"
}
