{
  "id": "lesson-14-01",
  "title": "Testing Pyramid for Flutter",
  "description": "Understand the testing pyramid concept and how to balance unit, widget, and integration tests in Flutter applications.",
  "moduleId": "module-14",
  "order": 1,
  "estimatedMinutes": 30,
  "difficulty": "intermediate"
}
