{
  "id": "lesson-11-02",
  "title": "Lesson 11.2: REST Controllers - Building Your API",
  "description": "Build REST API endpoints with @RestController, handle path variables and request bodies, and return proper HTTP status codes with ResponseEntity.",
  "moduleId": "module-11",
  "order": 2,
  "estimatedMinutes": 45,
  "difficulty": "intermediate"
}
