{
  "id": "lesson-01-05",
  "title": "Module 0, Lesson 5: Troubleshooting Common Setup Issues",
  "description": "Diagnose and fix common Flutter setup problems using flutter doctor, resolve PATH issues, Gradle build failures, CocoaPods errors, and learn Flutter DevTools for debugging.",
  "moduleId": "module-01",
  "order": 5,
  "estimatedMinutes": 60,
  "difficulty": "beginner"
}
