{
  "id": "lesson-13-02",
  "title": "Local Storage Options",
  "description": "Compare Flutter's local storage solutions including SharedPreferences, Hive, SQLite, and Drift for different use cases.",
  "moduleId": "module-13",
  "order": 2,
  "estimatedMinutes": 40,
  "difficulty": "intermediate"
}
