{
  "id": "lesson-15-07",
  "title": "Accessibility Fundamentals",
  "moduleId": "module-15",
  "order": 7,
  "estimatedMinutes": 45,
  "difficulty": "intermediate",
  "description": "Make your apps usable by everyone with screen reader support, semantic widgets, and accessibility best practices"
}
