{
  "id": "lesson-07-04",
  "title": "Module 6, Lesson 4: Deep Linking",
  "description": "Configure deep linking so users can open specific screens from URLs, push notifications, and other apps using go_router and the app_links package.",
  "moduleId": "module-07",
  "order": 4,
  "estimatedMinutes": 60,
  "difficulty": "intermediate"
}
