{
  "id": "lesson-05-06",
  "title": "Lesson 5.6: Lambda Expressions - Functions as Data",
  "description": "Write lambda expressions to pass behavior as data, use built-in functional interfaces (Predicate, Function, Consumer, Supplier), and apply method references.",
  "moduleId": "module-05",
  "order": 6,
  "estimatedMinutes": 45,
  "difficulty": "intermediate"
}
