{
  "id": "lesson-01-01",
  "title": "Module 0, Lesson 1: Installing Flutter & Dart SDK",
  "description": "Download and install the Flutter SDK (which includes Dart), configure PATH environment variables on Windows, macOS, and Linux, and verify the installation with flutter doctor.",
  "moduleId": "module-01",
  "order": 1,
  "estimatedMinutes": 40,
  "difficulty": "beginner"
}
