{
  "id": "10.6",
  "title": "Auth Flow: OAuth",
  "moduleId": "module-10",
  "order": 6,
  "estimatedMinutes": 60,
  "difficulty": "intermediate",
  "description": "Implement social login with Google and Apple Sign-In using Serverpod's authentication module, including platform-specific configuration and account linking"
}