{
  "id": "lesson-02-01",
  "title": "Lesson 2.1: Data Types in Depth",
  "description": "Master Java's essential data types (int, double, String, boolean), type conversion, text blocks, and modern string formatting with .formatted().",
  "moduleId": "module-02",
  "order": 1,
  "estimatedMinutes": 30,
  "difficulty": "beginner"
}
